key,Name,Description,Link,Download
0,Abdominal and Direct Fetal ECG Database,"Multichannel fetal electrocardiogram recordings obtained from 5 different women in labor, between 38 and 41 weeks of gestation.",https://physionet.org/content/adfecgdb/,https://physionet.org/static/published-projects/adfecgdb/abdominal-and-direct-fetal-ecg-database-1.0.0.zip
1,AF Termination Challenge Database,"ECG recordings created for the Computers in Cardiology Challenge 2004, which focused on predicting spontaneous termination of atrial fibrillation.",https://physionet.org/content/aftdb/,https://physionet.org/static/published-projects/aftdb/af-termination-challenge-database-1.0.0.zip
2,AHA Database Sample Excluded Record,Two ECG signals that were excluded from the 1980 American Heart Association database.,https://physionet.org/content/ahadb/,https://physionet.org/static/published-projects/ahadb/aha-database-sample-excluded-record-1.0.0.zip
3,ANSI/AAMI EC13 Test Waveforms,"The files in this set can be used for testing a variety of devices that
monitor the electrocardiogram. The recordings include both synthetic and real
waveforms.",https://physionet.org/content/aami-ec13/,https://physionet.org/static/published-projects/aami-ec13/ansiaami-ec13-test-waveforms-1.0.0.zip
4,Apnea-ECG Database,Seventy ECG signals with expert-labelled apnea annotations and machine-generated QRS annotations.,https://physionet.org/content/apnea-ecg/,https://physionet.org/static/published-projects/apnea-ecg/apnea-ecg-database-1.0.0.zip
5,A Pressure Map Dataset for In-bed Posture Classification,Pressure sensor data captured from 13 participants in various sleeping postures.,https://physionet.org/content/pmd/,https://physionet.org/static/published-projects/pmd/a-pressure-map-dataset-for-in-bed-posture-classification-1.0.0.zip
6,Autonomic Aging: A dataset to quantify changes of cardiovascular autonomic function during healthy aging,"This database contains resting recordings of ECG and continuous noninvasive blood pressure of 1,104 healthy volunteers",https://physionet.org/content/autonomic-aging-cardiovascular/,https://physionet.org/static/published-projects/autonomic-aging-cardiovascular/autonomic-aging-a-dataset-to-quantify-changes-of-cardiovascular-autonomic-function-during-healthy-aging-1.0.0.zip
7,Behavioral and autonomic dynamics during propofol-induced unconsciousness,Multimodal point process indices for heart rate variability and electrodermal activity for 9 subjects who are undergoing a controlled propofol sedation experiment where the concentration was increased and then decreased in stages.,https://physionet.org/content/propofol-anesthesia-dynamics/,https://physionet.org/static/published-projects/propofol-anesthesia-dynamics/behavioral-and-autonomic-dynamics-during-propofol-induced-unconsciousness-1.0.zip
8,BIDMC Congestive Heart Failure Database,Long-term ECG recordings from 15 subjects with severe congestive heart failure.,https://physionet.org/content/chfdb/,https://physionet.org/static/published-projects/chfdb/bidmc-congestive-heart-failure-database-1.0.0.zip
9,BIDMC PPG and Respiration Dataset,"ECG signals extracted from the MIMIC-II Matched Waveform Database, with manual breath annotations added by annotators using impedance respiratory signal.",https://physionet.org/content/bidmc/,https://physionet.org/static/published-projects/bidmc/bidmc-ppg-and-respiration-dataset-1.0.0.zip
